,user_name,screen_name,statuses_count,followers_count,friends_count,favourites_count,listed_count,location,default_profile,profile_image_url,profile_background_image_url_https,profile_background_image_url,utc_offset,description,label
1,Shawn,8VD6Y,9,19,380,0,0,"Coconut Creek, Florida",FALSE,http://pbs.twimg.com/profile_images/707198051102953472/En003uXT_normal.jpg,https://abs.twimg.com/images/themes/theme8/bg.gif,http://abs.twimg.com/images/themes/theme8/bg.gif,-25200,"Guitarist,  Vengeance  You!!!",fake_users
2,Jeffrey A.,jefygfr,24,28,723,0,0,Southwest Missouri,FALSE,http://pbs.twimg.com/profile_images/705294463065841664/J_r9FjJ9_normal.jpg,https://abs.twimg.com/images/themes/theme17/bg.gif,http://abs.twimg.com/images/themes/theme17/bg.gif,-25200,"President,  American Birding Association. 
Avid natural history fan, part-time pop culture maven, photographer, musician, and",fake_users
3,Toxic,Toxicghts1o9,2624,36,640,2406,16,Wyoming,FALSE,http://pbs.twimg.com/profile_images/714166043363700736/rTdiw-T5_normal.jpg,https://abs.twimg.com/images/themes/theme5/bg.gif,http://abs.twimg.com/images/themes/theme5/bg.gif,-25200,"19, Gamer, Drummer -  Just do what  the  makes you happy.",fake_users
5,Michael,michaelreesertg,726,23,538,712,0,"Brunswick, Maine",FALSE,http://pbs.twimg.com/profile_images/707645906246438912/txeg3jw__normal.jpg,https://abs.twimg.com/images/themes/theme19/bg.gif,http://abs.twimg.com/images/themes/theme19/bg.gif,-25200,Nominated guitarist   the year LA Music awards/recording artist.,fake_users
6,Justin,bitobsonto,573,21,594,524,4,Massachusetts,FALSE,http://pbs.twimg.com/profile_images/706629405007810560/0e5-3KBZ_normal.jpg,https://abs.twimg.com/images/themes/theme2/bg.gif,http://abs.twimg.com/images/themes/theme2/bg.gif,-25200,"iZotopean. EDM Producer/DJ. follow  me and like my other pages!
Soundcloud: https://t.co/n0qmSAWBFy 
Facebook: https://t.co/EBlr5l8pvd",fake_users
7,Anchalen,AnchalenicusM,1418,24,662,1258,32,Delaware,FALSE,http://pbs.twimg.com/profile_images/712960317542629376/TQjIehr-_normal.jpg,https://abs.twimg.com/images/themes/theme16/bg.gif,http://abs.twimg.com/images/themes/theme16/bg.gif,-25200,Anchalen International Records is  a premier Dance/Jazz and Electronic Music Indie Record label. (A unit  Anchalen Music Industries U.S.A.),fake_users
8,Karina,December103_102,340,14,633,237,10,"Napa, California, USA",FALSE,http://pbs.twimg.com/profile_images/713512098094063616/jSv8GheQ_normal.jpg,https://abs.twimg.com/images/themes/theme17/bg.gif,http://abs.twimg.com/images/themes/theme17/bg.gif,-25200,Just  Your Average 18 yr  Searchin' For Something To Call Mine. 719 Is H O M E  || Roll || Rave || EDM || REPEAT ||,fake_users
9,Look 2,Look2Murderres,811,15,676,723,7,"Manhattan, New York",FALSE,http://pbs.twimg.com/profile_images/714188015351029760/2jHozzy2_normal.jpg,https://abs.twimg.com/images/themes/theme12/bg.gif,http://abs.twimg.com/images/themes/theme12/bg.gif,-25200,Djs / Producers / Remixes  #EDM #MashUp #Soundcloud https://t.co/U26Cv7t8g8 …,fake_users
10,Nathan,SuckMahkuFc,305,15,606,244,9,New Mexico,FALSE,http://pbs.twimg.com/profile_images/712119692966666241/j7nxazpH_normal.jpg,https://abs.twimg.com/images/themes/theme16/bg.gif,http://abs.twimg.com/images/themes/theme16/bg.gif,-25200,Vocals in @therisingtidenc  | Gamer  slowly becoming a musician |,fake_users
12,GGC,ggce_ct,614,17,706,555,14,"Portland, Oregon",FALSE,http://pbs.twimg.com/profile_images/683024966426738688/CSeE5GxI_normal.jpg,https://abs.twimg.com/images/themes/theme12/bg.gif,http://abs.twimg.com/images/themes/theme12/bg.gif,-25200,mission of the CTE is to provide programming that promotes the design and implementation  of creative learning environments.,fake_users
14,Markeisha,MarkehiEas,13,22,320,0,0,"Los Angeles, California",FALSE,http://pbs.twimg.com/profile_images/708148502216511489/HkyoXIO0_normal.jpg,https://abs.twimg.com/images/themes/theme13/bg.gif,http://abs.twimg.com/images/themes/theme13/bg.gif,-25200,"Soul singer/songwriter, pianist,  web  https://t.co/vnoRC7bV0K",fake_users
16,Magnolia,active_arew,267,16,728,205,3,Georgia,FALSE,http://pbs.twimg.com/profile_images/697279593376563200/26oy2Aqn_normal.jpg,https://abs.twimg.com/images/themes/theme5/bg.gif,http://abs.twimg.com/images/themes/theme5/bg.gif,-25200,Magnolia Activewear is a fabulous online shop  for active women. Our unique activewear is designed  and manufactured in Brazil.,fake_users
19,Jeff,JeffBayls1es,33,12,585,0,1,Massachusetts,FALSE,http://pbs.twimg.com/profile_images/712243555738238976/MwM43VQM_normal.jpg,https://abs.twimg.com/images/themes/theme5/bg.gif,http://abs.twimg.com/images/themes/theme5/bg.gif,-25200,"Professional composer/songwriter, drummer,  and bassist. I live for creating music and connecting  with people!",fake_users
21,Darius,D_cl74aer,934,36,443,886,1,"Bingham Farms, Michigan",FALSE,http://pbs.twimg.com/profile_images/726508650043416576/cWaKjTOy_normal.jpg,https://abs.twimg.com/images/themes/theme2/bg.gif,http://abs.twimg.com/images/themes/theme2/bg.gif,-25200,"Former Student Athlete at Minnesota State  , Mankato",fake_users
22,Delphine,delmckynlie,1073,23,540,951,19,"dallas, texas",FALSE,http://pbs.twimg.com/profile_images/713985338742542337/_jW_MhpV_normal.jpg,https://abs.twimg.com/images/themes/theme5/bg.gif,http://abs.twimg.com/images/themes/theme5/bg.gif,-25200,Entrepreneur/ Painter/  Musician/ Advertising/  York/ Paris,fake_users
24,Philip,Philip_Laserist,967,28,773,851,13,Hawaii,TRUE,http://pbs.twimg.com/profile_images/706503217245335552/axurxu9L_normal.jpg,https://abs.twimg.com/images/themes/theme1/bg.png,http://abs.twimg.com/images/themes/theme1/bg.png,-25200,"Official Twitter  Philip Lassiter 6x Grammy Award Winning Arranger, Section-Leader,  Arranger & Trumpeter for Prince, sought after songwriter and musician.",fake_users
28,Eclectic,EclctcEscnees,978,19,398,921,0,"Dix Hills, New York",FALSE,http://pbs.twimg.com/profile_images/712620611244150784/WypXVAiK_normal.jpg,https://abs.twimg.com/images/themes/theme12/bg.gif,http://abs.twimg.com/images/themes/theme12/bg.gif,-25200,Putting together a jazz /  pop / classical ensemble - currently need a  and a guitar and horn section would be nice,fake_users
30,Andrew,andrewlightftoo,64,13,622,0,0,"Burbank, California",FALSE,http://pbs.twimg.com/profile_images/713485328712134656/M7iys9VE_normal.jpg,https://abs.twimg.com/images/themes/theme7/bg.gif,http://abs.twimg.com/images/themes/theme7/bg.gif,-25200,"Follower  Christ, Husband, Owner of @matchstickweb (Matchstick Websites),  Musician and Consultant.",fake_users
32,Linda,LindaeemNc,1811,23,634,1595,30,USA. Georgia,FALSE,http://pbs.twimg.com/profile_images/715217317127405570/2zGxTKKg_normal.jpg,https://abs.twimg.com/images/themes/theme2/bg.gif,http://abs.twimg.com/images/themes/theme2/bg.gif,-25200,"Commenting on US & world news,  Russia, developing countries. Work-related @LindaENemec. Support & often listening to live music, . Out & about in WDC",fake_users
35,Daniel,IamDani08le8,960,16,608,762,19,New York City,FALSE,http://pbs.twimg.com/profile_images/715009670415577088/EG3EXfbo_normal.jpg,https://abs.twimg.com/images/themes/theme17/bg.gif,http://abs.twimg.com/images/themes/theme17/bg.gif,-25200,"Drummer  4 Life & Preacher  the word,",fake_users
39,Jonathan,jonsuanlh,65,15,592,0,0,Florida,FALSE,http://pbs.twimg.com/profile_images/715682645871464452/U9-wkdS1_normal.jpg,https://abs.twimg.com/images/themes/theme13/bg.gif,http://abs.twimg.com/images/themes/theme13/bg.gif,-25200,"Commercial & insurance litigation attorney at @AT_Law. Classically trained musician / interest in copyright law & ballot initiatives. Proud husband,  father.",fake_users
45,Sage,SageK1ing,675,30,523,641,6,"Hoboken, New Jersey",FALSE,http://pbs.twimg.com/profile_images/717504769313492992/Uzk_x6bh_normal.jpg,https://abs.twimg.com/images/themes/theme12/bg.gif,http://abs.twimg.com/images/themes/theme12/bg.gif,-25200,"Singer/songwriter/

Pain  EP *feat. Robbie Merrill of GODSMACK
coming soon",fake_users
47,Accelerate !,AccelerateTiwt,1202,15,499,1114,17,California,FALSE,http://pbs.twimg.com/profile_images/696543886420750336/CRK8zttA_normal.jpg,https://abs.twimg.com/images/themes/theme3/bg.gif,http://abs.twimg.com/images/themes/theme3/bg.gif,-25200,Helping Companies Win New Business - Providing High-Leverage Business  Services - - - Plan | Position | Pursue |  PROPOSE | Perform!,fake_users
48,Drew,dcunningha5190m,22,9,634,0,1,New York,FALSE,http://pbs.twimg.com/profile_images/711065736630829056/BCr0NhoF_normal.jpg,https://abs.twimg.com/images/themes/theme8/bg.gif,http://abs.twimg.com/images/themes/theme8/bg.gif,-25200,Christian Musician who loves  and  loves music i play the 2nd trumpet in The ACA Jazz band,fake_users
49,Luke McBride,LukeMcBrid2e7,420,38,539,360,9,"Tell City, Indiana",FALSE,http://pbs.twimg.com/profile_images/737529551794802688/YiZaFi44_normal.jpg,https://abs.twimg.com/images/themes/theme1/bg.png,http://abs.twimg.com/images/themes/theme1/bg.png,-25200,All for  the man above 2017 G/C Marcus https://t.co/IFFXkYMhr5 …,fake_users
52,Brody,brodymulilnga,1707,18,697,1419,34,New Jersey,TRUE,http://pbs.twimg.com/profile_images/713703862838960128/4Nf0Fx1l_normal.jpg,https://abs.twimg.com/images/themes/theme1/bg.png,http://abs.twimg.com/images/themes/theme1/bg.png,-25200,"President, United Media Syndicate. Principal / Associate Principal Trumpet, ISB & ISO. Contemporary  composer, producer and . Perpetually jet-lagged.",fake_users
55,BergenMom,BergeMonm,2644,33,783,2360,49,"New Orleans , Louisiana",FALSE,http://pbs.twimg.com/profile_images/676846861974560768/9x64JH5__normal.jpg,https://abs.twimg.com/images/themes/theme11/bg.gif,http://abs.twimg.com/images/themes/theme11/bg.gif,-25200,I'm a Mom of teens thats soon to  an empty nester. Finding myself with time for me and  it's strange. I wonder who I am now?,fake_users
59,Milan,ACMilaosrnB,802,26,586,680,2,South Florida,FALSE,http://pbs.twimg.com/profile_images/721826297106706432/lB-NaP_l_normal.jpg,https://abs.twimg.com/images/themes/theme12/bg.gif,http://abs.twimg.com/images/themes/theme12/bg.gif,-25200,"Two brothers. Two Milan supporters, committed to providing you with the latest news, updates, articles & insight on  all  #ACMilan.",fake_users
60,pleasuresthemovie,POBOOStheeviom,645,20,485,502,15,New Hampshire,FALSE,http://pbs.twimg.com/profile_images/717629182323232769/td-GIUCm_normal.jpg,https://abs.twimg.com/images/themes/theme7/bg.gif,http://abs.twimg.com/images/themes/theme7/bg.gif,-25200,The Pleasures of Being Out  of Step is a documentary profile of the legendary jazz  and civil libertarian Nat Hentoff.,fake_users
61,10k Queen!,SmokeAlottaKhus,30,54,533,0,0,Westchester New York,FALSE,http://pbs.twimg.com/profile_images/737521693598449667/zZRLwDQS_normal.jpg,https://abs.twimg.com/images/themes/theme1/bg.png,http://abs.twimg.com/images/themes/theme1/bg.png,-25200,"Sing With A Passion  .   # 
AMNJ My , 10k   LongLiveBarrie  Fly high Devin",fake_users
63,Dale Horn,e66ba92e4c14cda,58,14,739,0,0,South Dakota,FALSE,http://pbs.twimg.com/profile_images/713758918875414528/TapGkJkH_normal.jpg,https://abs.twimg.com/images/themes/theme8/bg.gif,http://abs.twimg.com/images/themes/theme8/bg.gif,-25200,"EDM, SKRILLEX ,MARSHMELLO,
Producer in the works,Baseball &  Drag Racing are the sports,WINTER FEELS ARE HERE!

 Me",fake_users
64,WilliamDangerHaynes,DangerHensya,404,13,616,284,3,New York,FALSE,http://pbs.twimg.com/profile_images/715141182561640449/SylXmPtT_normal.jpg,https://abs.twimg.com/images/themes/theme7/bg.gif,http://abs.twimg.com/images/themes/theme7/bg.gif,-25200,"Musician / Performer / Explorer  trying this whole internet , while it lasts.",fake_users
65,Sheena,SheenMFca,1554,23,765,1375,18,"Mount Vernon, Texas",FALSE,http://pbs.twimg.com/profile_images/679262159742869505/Pi5OtJo__normal.jpg,https://abs.twimg.com/images/themes/theme3/bg.gif,http://abs.twimg.com/images/themes/theme3/bg.gif,-25200,"Writer, gamer, artist, and wifey extraordinaire!   live in Seattle, WA with two cats that pretty much own me. GT: Chickenmnyduck",fake_users
67,Michael,mbahareaen,672,20,745,558,10,North Carolina,FALSE,http://pbs.twimg.com/profile_images/714827736305561600/YpAFUD-e_normal.jpg,https://abs.twimg.com/images/themes/theme7/bg.gif,http://abs.twimg.com/images/themes/theme7/bg.gif,-25200,"Runner, musician, and KC native. DC-based. I mostly  tweet about politics and sports (mostly  Broncos).",fake_users
68,Midnight C. w S.W..,MCwsoundavswe,417,18,674,369,8,South Dakota,FALSE,http://pbs.twimg.com/profile_images/711949087914926080/6x0RmU1c_normal.jpg,https://abs.twimg.com/images/themes/theme8/bg.gif,http://abs.twimg.com/images/themes/theme8/bg.gif,-25200,"Midnight Confessions with Sound Waves-   https://t.co/hEpdNo8pEB …
#midnightconfessions #soundwavesofficial #edm",fake_users
70,Denton Arnell .,Dentonalreln,719,12,297,649,0,Indiana,FALSE,http://pbs.twimg.com/profile_images/713582011676565505/SdDFWvb5_normal.jpg,https://abs.twimg.com/images/themes/theme16/bg.gif,http://abs.twimg.com/images/themes/theme16/bg.gif,-25200,Musician/Producer//Songwriter/Manager/,fake_users
71,Lance,dj_onus,20,28,682,4,0,New York City,FALSE,http://pbs.twimg.com/profile_images/707130057341296640/R6Ngs5cC_normal.jpg,https://abs.twimg.com/images/themes/theme5/bg.gif,http://abs.twimg.com/images/themes/theme5/bg.gif,-25200,"DJ, Musician, composer, , writter, graphic artist, photographer, animated video producer,  etc. Extreme music lover!",fake_users
72,Barry Merritt,Coach_Merirtt,206,37,497,141,13,"Denver / Arvada, Colorado",FALSE,http://pbs.twimg.com/profile_images/736963828123045888/svMBfwyt_normal.jpg,https://abs.twimg.com/images/themes/theme1/bg.png,http://abs.twimg.com/images/themes/theme1/bg.png,-25200,"PE teacher and  football coach at AL Brown HS in Kannapolis, NC. Married to @Mariya_Merritt!!! Father  JB, he's adorable, in case you didn't already know.",fake_users
73,Brendan,GarciaBaat0335s,74,17,385,0,0,Alabama,FALSE,http://pbs.twimg.com/profile_images/715362342037491712/zf-eWrrO_normal.jpg,https://abs.twimg.com/images/themes/theme5/bg.gif,http://abs.twimg.com/images/themes/theme5/bg.gif,-25200,"Student Athlete at EHS. 'm 17, birthday april 6. Musician play drums  and guitar",fake_users
74,Emily † .,KillJoyisllM,52,9,339,0,0,Wilsonville Oregon,FALSE,http://pbs.twimg.com/profile_images/715505369330688000/EZb4bq4q_normal.jpg,https://abs.twimg.com/images/themes/theme16/bg.gif,http://abs.twimg.com/images/themes/theme16/bg.gif,-25200,23. artist & crafter.  musician & songwriter. dreamer. baby mama. cat lady. friend of jesus. I like making  a mess because I am one.,fake_users
80,Mike Greenslade,MikeGreensldea,101,39,1570,68,0,Melbourne,TRUE,http://pbs.twimg.com/profile_images/530012695618002944/kABdbS48_normal.jpeg,https://abs.twimg.com/images/themes/theme1/bg.png,http://abs.twimg.com/images/themes/theme1/bg.png,-39600,"Commercial photographer, General Manager of  ShelterBox Australia and ShelterBox Response  member based in the the Northern Rivers area of NSW. Opinions mine",fake_users
81,K. Howard-,mskhowadr,33,16,693,12,1,"San Diego, California",FALSE,http://pbs.twimg.com/profile_images/710575594677923840/oPovdiAf_normal.jpg,https://abs.twimg.com/images/themes/theme18/bg.gif,http://abs.twimg.com/images/themes/theme18/bg.gif,-25200,"Secondary Choir Teacher, , Mother, Cheer mom, Church Girl,  & Musician.",fake_users
82,wtzapper,wtzreapp,26,22,597,0,0,"Salt Lake City, Utah",FALSE,http://pbs.twimg.com/profile_images/722502485831757824/kWFAytyb_normal.jpg,https://abs.twimg.com/images/themes/theme3/bg.gif,http://abs.twimg.com/images/themes/theme3/bg.gif,-25200,"Sport and Performance Psychology , weight  loss and diet coach, fitness trainer",fake_users
86,Tom,to2tp0m,2832,25,672,2508,49,Arizona,FALSE,http://pbs.twimg.com/profile_images/711650594226905089/hhpbMF9e_normal.jpg,https://abs.twimg.com/images/themes/theme7/bg.gif,http://abs.twimg.com/images/themes/theme7/bg.gif,-25200,"Dad, Apple fan-boy, App addict, music/band teacher, musician of acoustic covers and originals, and all around-laid back-happy   lucky guy.",fake_users
88,bongripzz420,Bongrip2p04z,327,19,539,293,3,"Farmington Hills, Michigan",FALSE,http://pbs.twimg.com/profile_images/717658848639787008/vq-FLjjI_normal.jpg,https://abs.twimg.com/images/themes/theme8/bg.gif,http://abs.twimg.com/images/themes/theme8/bg.gif,-25200,Im a fucking metal head..a  drummer and i have a voice that will make you want to commit  murder...KEEP METAL ALIVE /,fake_users
89,Jonathan,jonohtca,72,14,593,0,0,central Minnesota,FALSE,http://pbs.twimg.com/profile_images/714325120144293888/kOJ-fLrZ_normal.jpg,https://abs.twimg.com/images/themes/theme11/bg.gif,http://abs.twimg.com/images/themes/theme11/bg.gif,-25200,"Husband, Dad, Avid DIY guy. # by Profession, Christian, Musician, Liberty Advocate,  Hobby Farmer & Home Brewer by Passion",fake_users
90,William,Healinggaeorl,2449,25,697,2235,45,"Greenwich Village, New York",FALSE,http://pbs.twimg.com/profile_images/676389733707194368/-vyU2A1W_normal.jpg,https://abs.twimg.com/images/themes/theme7/bg.gif,http://abs.twimg.com/images/themes/theme7/bg.gif,-25200,"Retired Air Force Colonel and Aerospace Chief Systems Engineer.  active home  based eCommerce business Entrepreneur, Father, Grandfather and Great-grandfather.",fake_users
91,Jason Hüelbig,jason_hueblig,986,42,523,901,3,"Mesa, Arizona, USA",FALSE,http://pbs.twimg.com/profile_images/733358252700798977/ICD47Vww_normal.jpg,https://abs.twimg.com/images/themes/theme1/bg.png,http://abs.twimg.com/images/themes/theme1/bg.png,-25200,Drew  University Basketball #,fake_users
92,Bryce,BryceittuT,909,27,666,779,25,Minnesota,FALSE,http://pbs.twimg.com/profile_images/715519890916913152/KJxt-m8M_normal.jpg,https://abs.twimg.com/images/themes/theme12/bg.gif,http://abs.twimg.com/images/themes/theme12/bg.gif,-25200,23.  420. . Music Producer. MN.,fake_users
95,Amanda,Dare_2_aDenc,77,17,681,0,0,Ohio,FALSE,http://pbs.twimg.com/profile_images/714175498826485761/XZ17ty-F_normal.jpg,https://abs.twimg.com/images/themes/theme18/bg.gif,http://abs.twimg.com/images/themes/theme18/bg.gif,-25200,"2 Dance, Dance Co. Offering classes in tap,jazz, hip hop, ballet,  lyrical and pom!",fake_users
98,Ravi,ragaravishanrka,45,48,665,35,0,"M'AnneHeche, New York",FALSE,http://pbs.twimg.com/profile_images/704895409056043010/2dlfS55K_normal.jpg,https://abs.twimg.com/images/themes/theme4/bg.gif,http://abs.twimg.com/images/themes/theme4/bg.gif,-25200,"Official Twitter for  Ravi Shankar: sitarist, composer, teacher, and writer. Curated by @ and the Ravi Shankar Foundation.",fake_users
100,Tommy,tommybyre372n,1770,26,466,1547,12,West Virginia,FALSE,http://pbs.twimg.com/profile_images/714483807399882752/BZBHR3s0_normal.jpg,https://abs.twimg.com/images/themes/theme18/bg.gif,http://abs.twimg.com/images/themes/theme18/bg.gif,-25200,"Musician for my Band Onto , songwriter, Sports Producer for ABC Radio Network,  Godfather, entertainer.",fake_users
102,Matt,mattyjjuscite,13,11,362,0,0,California,FALSE,http://pbs.twimg.com/profile_images/711139176381480960/LzrdiBPR_normal.jpg,https://abs.twimg.com/images/themes/theme11/bg.gif,http://abs.twimg.com/images/themes/theme11/bg.gif,-25200,preacher/,fake_users
103,Dijon,DijonTwtees,730,19,643,653,7,Oklahoma City,FALSE,http://pbs.twimg.com/profile_images/714078452752756736/a21sKk9f_normal.jpg,https://abs.twimg.com/images/themes/theme10/bg.gif,http://abs.twimg.com/images/themes/theme10/bg.gif,-25200,"Musician, Artist, production team @soshified, gamer, nerd.  I love all things Japanese and Kpop is  world :D check out my youtube page for some of my music :)",fake_users
104,Aaron Bensing,ATB461,741,31,527,657,21,Kentucky,FALSE,http://pbs.twimg.com/profile_images/735822990827393024/7CxpxtgB_normal.jpg,https://abs.twimg.com/images/themes/theme1/bg.png,http://abs.twimg.com/images/themes/theme1/bg.png,-25200,"Columbus native, proudly say I'm from Ohio. Passionate hockey fan, especially #CBJ. Motorsports enthusiast. Tweet  other sports  and topics too.",fake_users
105,Will,CARVEUtRiP,28,14,657,0,0,"Worcester, Massachusetts",FALSE,http://pbs.twimg.com/profile_images/712222442324959232/0KN3gI2X_normal.jpg,https://abs.twimg.com/images/themes/theme12/bg.gif,http://abs.twimg.com/images/themes/theme12/bg.gif,-25200,I'm   Musician and a Gamer. Does that make me cool?,fake_users
106,Jim,bookibvjt,2616,28,622,2265,57,"Washington, DC",FALSE,http://pbs.twimg.com/profile_images/711443338847768580/jmCY99TW_normal.jpg,https://abs.twimg.com/images/themes/theme13/bg.gif,http://abs.twimg.com/images/themes/theme13/bg.gif,-25200,"Proud dad to 2  beautiful little girls, SPIRE FITNESS co-founder, health & wellness coach, runner, Badger, musician,  Ironman, occasional ultra runner",fake_users
107,Kirsten Chambers,KChamber_s21,3476,58,517,3139,39,"Cleveland,Ohio",FALSE,http://pbs.twimg.com/profile_images/733341702862307328/vX0zTiEW_normal.jpg,https://abs.twimg.com/images/themes/theme1/bg.png,http://abs.twimg.com/images/themes/theme1/bg.png,-25200,~Family  friends are most important~ •Adrian College  Soccer•2018• @JoeyLoselle,fake_users
108,Kelle,kellwleee,1053,31,673,1023,7,Tennessee,FALSE,http://pbs.twimg.com/profile_images/706324337691766784/ds-SW0Kt_normal.jpg,https://abs.twimg.com/images/themes/theme4/bg.gif,http://abs.twimg.com/images/themes/theme4/bg.gif,-25200,"Ukulele-playing, jazz singer   media personality using music to inspire the joy of living life creatively.",fake_users
111,Lathe,LatheTrllos,975,15,768,873,15,Maryland,FALSE,http://pbs.twimg.com/profile_images/676437794965733377/_ePKKFIp_normal.jpg,https://abs.twimg.com/images/themes/theme4/bg.gif,http://abs.twimg.com/images/themes/theme4/bg.gif,-25200,"The Secret Society of Lathe Trolls: International chat  devoted to  record-cutting deviants, renegades, professionals & experimenters.  Official Twitter!",fake_users
112,The,blagucddra,570,44,504,488,7,North Carolina,FALSE,http://pbs.twimg.com/profile_images/727146944359968769/X60sMwcs_normal.jpg,https://abs.twimg.com/images/themes/theme2/bg.gif,http://abs.twimg.com/images/themes/theme2/bg.gif,-25200,"With 8 HD TVs, 20 killer draft beers, and great food, the Blaguard is a great stop for a game, happy hour, or your  watering hole. DC  SPORTS COME FIRST",fake_users
114,abrbmusi,rbmusifnoic,21,16,650,0,0,Florida,FALSE,http://pbs.twimg.com/profile_images/716252652711981057/m5iL3lP-_normal.jpg,https://abs.twimg.com/images/themes/theme3/bg.gif,http://abs.twimg.com/images/themes/theme3/bg.gif,-25200,musician   love R&B Music,fake_users
115,James,jamzreoflo,416,12,278,290,11,"Boston, Massachusetts",FALSE,http://pbs.twimg.com/profile_images/713945251896041473/kQcHmf38_normal.jpg,https://abs.twimg.com/images/themes/theme3/bg.gif,http://abs.twimg.com/images/themes/theme3/bg.gif,-25200,"17 - Rocky Hill  - Probably High                       Jazz is not just music, it's  way of life",fake_users
117,Lennon P.,lennoenbno,972,14,340,899,8,"Houston, Texas",FALSE,http://pbs.twimg.com/profile_images/706747071148195841/GX2BmE4J_normal.jpg,https://abs.twimg.com/images/themes/theme2/bg.gif,http://abs.twimg.com/images/themes/theme2/bg.gif,-25200,. Composer. Drummer. Self propelling  musician.,fake_users
122,Harry,harryejfaf,433,39,458,401,12,Conway Arkansas,FALSE,http://pbs.twimg.com/profile_images/726120377559093249/BCMFwzeH_normal.jpg,https://abs.twimg.com/images/themes/theme13/bg.gif,http://abs.twimg.com/images/themes/theme13/bg.gif,-25200,"write on media  and dc crime, politics, people, sports; keep , too.",fake_users
128,MyTreasuryPro,TreasuryofsrP,1055,34,575,922,3,"Oregon, USA",FALSE,http://pbs.twimg.com/profile_images/722706092195753984/PSPIhT4P_normal.jpg,https://abs.twimg.com/images/themes/theme12/bg.gif,http://abs.twimg.com/images/themes/theme12/bg.gif,-25200,"The only, for life,  personal level, TreasuryProfs, approved course in Treasury Management Athletics  in the Chicagoland area.",fake_users
131,A Modest,AModesttarSt,69,12,607,0,0,California,FALSE,http://pbs.twimg.com/profile_images/714217998442176517/kn3WKOGV_normal.jpg,https://abs.twimg.com/images/themes/theme16/bg.gif,http://abs.twimg.com/images/themes/theme16/bg.gif,-25200,"Showcasing artists, musicians,  designers, writers, actors, directors, small business  and just awe-inspiring individuals who make their dreams reality.",fake_users
132,Hypersonic,hypersonicridoa,1850,36,684,1695,14,Alabama,FALSE,http://pbs.twimg.com/profile_images/705150425842917376/s0EsFa72_normal.jpg,https://abs.twimg.com/images/themes/theme12/bg.gif,http://abs.twimg.com/images/themes/theme12/bg.gif,-25200,ELECTRONIC DANCE MUSIC FROM  AUSTIN TEXAS AND FAR BEYOND #ATX #EDM #DJs #HOUSE #TECHNO # #LOCALS #NIGHTLIFE 24/7/265,fake_users
133,Denny G.,dendengennl,456,39,225,384,13,Kentucky,FALSE,http://pbs.twimg.com/profile_images/739216352737529856/M3Cz9Kg8_normal.jpg,https://abs.twimg.com/images/themes/theme1/bg.png,http://abs.twimg.com/images/themes/theme1/bg.png,-25200,"Saints,Ravens,NFL. zombie hunter, Bigfoot tracker, Ancient Aliens,Autobot, Captain America, Gun collector, World  ,Ghostbuster, Fantasy football geek",fake_users
137,UI,UIMusicOfflacii,612,31,286,574,2,"Los Angeles, California",FALSE,http://pbs.twimg.com/profile_images/716599180290961408/AQgMRy3S_normal.jpg,https://abs.twimg.com/images/themes/theme3/bg.gif,http://abs.twimg.com/images/themes/theme3/bg.gif,-25200,"EDM focused  label founded in 2012.  

https://t.co/zteJ0o7x4k",fake_users
138,D.J. Loope,DJLoeop,179,46,527,141,6,"Lubbock, Texas",FALSE,http://pbs.twimg.com/profile_images/732491455629905920/seZ1VLYq_normal.jpg,https://abs.twimg.com/images/themes/theme1/bg.png,http://abs.twimg.com/images/themes/theme1/bg.png,-25200,"Tennessean. Son of the South. Craft Beer, All things  Outside! Run. . Hike. longboard. Football is life #Vols #ManchesterUnited. All by the Grace of God.",fake_users
